chamber,congress,session,roll_number,chamber_roll_number,vote_date,title,question,result,yeas,nays,present,not_voting
Senate,116,2,278,278,2020-12-19,"Motion to Invoke Cloture: Eric J. Soskin to be Inspector General, Department of Transportation",On the Cloture Motion PN2029,Cloture Motion Rejected,39,48,0,13
Senate,116,2,279,279,2020-12-19,Motion to Invoke Cloture: Beth Harwell to be a Member of the Board of Directors of the Tennessee Valley Authority,On the Cloture Motion PN1609,Cloture Motion Agreed to,61,25,0,14
Senate,116,2,280,280,2020-12-19,"Confirmation: Beth Harwell, of Tennessee, to be a Member of the Board of Directors of the Tennessee Valley Authority",On the Nomination PN1609,Nomination Confirmed,59,25,0,16
Senate,116,2,281,281,2020-12-20,Motion to Invoke Cloture: Brian Noland to be a Member of the Board of Directors of the Tennessee Valley Authority,On the Cloture Motion PN1610,Cloture Motion Agreed to,84,5,0,11
Senate,116,2,282,282,2020-12-20,"Confirmation: Brian Noland, of Tennessee, to be a Member of the Board of Directors of the Tennessee Valley Authority",On the Nomination PN1610,Nomination Confirmed,84,5,0,11
Senate,116,2,283,283,2020-12-20,Motion to Invoke Cloture: Fernando L. Aenlle-Rocha to be U.S. District Judge for the Central District of California,On the Cloture Motion PN1380,Cloture Motion Agreed to,82,7,0,11
Senate,116,2,284,284,2020-12-20,"Confirmation: Fernando L. Aenlle-Rocha, of California, to be U.S. District Judge for the Central District of California",On the Nomination PN1380,Nomination Confirmed,80,8,0,12
Senate,116,2,285,285,2020-12-21,"Motion to Proceed to the Motion to Reconsider the Motion to Invoke Cloture on the Nomination of Eric J. Soskin, of Virginia, to be Inspector General, Department of Transportation",On the Motion to Proceed PN2029,Motion to Proceed Agreed to,48,46,0,6
Senate,116,2,286,286,2020-12-21,"Motion to Reconsider the Motion to Invoke Cloture on the Nomination of Eric J. Soskin, of Virginia, to be Inspector General, Department of Transportation",On the Motion to Reconsider PN2029,Motion to Reconsider Agreed to,48,46,0,6
Senate,116,2,287,287,2020-12-21,"Upon Reconsideration Motion to Invoke Cloture: Eric J. Soskin to be Inspector General, Department of Transportation",On the Cloture Motion PN2029,Cloture Motion Agreed to,48,44,0,8
Senate,116,2,288,288,2020-12-21,"Confirmation: Eric J. Soskin, of Virginia, to be Inspector General, Department of Transportation",On the Nomination PN2029,Nomination Confirmed,48,47,0,5
Senate,116,2,289,289,2020-12-21,Motion to Concur in the House Amendment to the Senate Amendment to H.R. 133,On the Motion (Motion to Concur in the House Amendment to the Senate Amendment to H.R. 133),Motion Agreed to,92,6,0,2
Senate,116,2,290,290,2020-12-30,Motion to Proceed to the Consideration of the Veto Message on H.R. 6395,On the Motion to Proceed H.R. 6395,Motion to Proceed Agreed to,80,12,0,8
Senate,116,2,291,291,2021-01-01,Motion to Invoke Cloture on the Veto Message on H.R. 6395,On the Cloture Motion H.R. 6395,Cloture Motion Agreed to,80,12,0,8
Senate,116,2,292,292,2021-01-01,"Shall the Bill H.R. 6395 Pass, the Objections of the President of the United States to the Contrary Notwithstanding?",On Overriding the Veto H.R. 6395,Veto Overridden,81,13,0,6
